{"version":2,"ts_ms":1757878149521,"engine":"dfs","phase":"search","run_id":"2025-09-14T19-29-08Z","container":{"cid":"de974d3619defd545271d4a7c6da052d5721a499dd6bda224ed2b8aa6ee2dfe4","cells":40},"metrics":{"nodes":3601,"pruned":0,"depth":8,"solutions":0,"elapsed_ms":1028,"best_depth":9},"stack":[{"instance_id":1,"piece_type":0,"piece_label":"A","cells":[{"i":-5,"j":2,"k":5},{"i":-4,"j":2,"k":5},{"i":-5,"j":3,"k":5},{"i":-4,"j":3,"k":5}]},{"instance_id":2,"piece_type":0,"piece_label":"A","cells":[{"i":-5,"j":3,"k":5},{"i":-4,"j":3,"k":5},{"i":-5,"j":4,"k":5},{"i":-4,"j":4,"k":5}]},{"instance_id":3,"piece_type":4,"piece_label":"E","cells":[{"i":-5,"j":5,"k":5},{"i":-4,"j":5,"k":5},{"i":-5,"j":6,"k":5},{"i":-4,"j":5,"k":6}]},{"instance_id":4,"piece_type":4,"piece_label":"E","cells":[{"i":-4,"j":3,"k":4},{"i":-3,"j":3,"k":4},{"i":-4,"j":4,"k":4},{"i":-3,"j":3,"k":5}]},{"instance_id":5,"piece_type":19,"piece_label":"T","cells":[{"i":-3,"j":2,"k":3},{"i":-2,"j":2,"k":3},{"i":-3,"j":3,"k":3},{"i":-1,"j":3,"k":3}]},{"instance_id":6,"piece_type":4,"piece_label":"E","cells":[{"i":-3,"j":3,"k":3},{"i":-2,"j":3,"k":3},{"i":-3,"j":4,"k":3},{"i":-2,"j":3,"k":4}]},{"instance_id":7,"piece_type":24,"piece_label":"Y","cells":[{"i":-3,"j":5,"k":3},{"i":-2,"j":5,"k":3},{"i":-2,"j":6,"k":3},{"i":-3,"j":7,"k":3}]},{"instance_id":8,"piece_type":24,"piece_label":"Y","cells":[{"i":-2,"j":2,"k":2},{"i":-1,"j":2,"k":2},{"i":-1,"j":3,"k":2},{"i":-2,"j":4,"k":2}]}],"stack_truncated":false}